{
  "main_exchange": "binance",
  "database_path": "storage/databases/database.db",
  "binance_base_url": "https://fapi.binance.com",
  "nats_url": "nats://127.0.0.1:4222",
  "stream": "ALGOTRADING_RUNTIME",
  "ranking_size": 100,
  "active_top_n": 50,
  "retain_after_top_n_days": 365,
  "minimum_history_days": 100,
  "max_parallel_requests": 64,
  "midnight_delay_ms": 0,
  "retry_after_failure_seconds": 300
}
